{
  "$schema": "./LDS3D_EXTERNAL_SURFACE.schema.json",
  "schemaVersion": 1,
  "kind": "lds3d-external-public-surface",
  "package": { "manifest": "package.json", "name": "@lk-design-system/lds-3d", "version": "0.1.0-alpha.2", "repository": "LK-Design-System/lk-design-system-3d" },
  "upstreamTokenDependencies": [
    "--component-card-fg-dark",
    "--color-semantic-background-normal-alternative",
    "--color-semantic-background-normal-normal",
    "--color-semantic-label-neutral",
    "--color-semantic-label-normal",
    "--color-semantic-label-strong",
    "--color-semantic-line-solid-normal",
    "--color-semantic-primary-normal",
    "--color-semantic-primary-surface-normal",
    "--color-semantic-status-negative-foreground",
    "--color-semantic-status-negative-text",
    "--color-semantic-status-positive-foreground",
    "--color-semantic-status-positive-text",
    "--font-sans",
    "--heading2-line",
    "--heading2-size",
    "--heading2-spacing",
    "--label1-reading-line",
    "--label1-size",
    "--radius-lg",
    "--space-1",
    "--space-2",
    "--space-3",
    "--space-4",
    "--space-5",
    "--space-6",
    "--space-8"
  ],
  "runtimeCustomProperties": ["--lds3d-inspector-width"],
  "packages": [
    { "manifest": "packages/assets/package.json", "name": "@lk-design-system/lds-3d-assets", "version": "0.1.0-alpha.2", "exports": [".", "./schema", "./legacy", "./robots/catalog.json", "./robots/tron/tron.glb", "./robots/tron/tron.asset-manifest.json", "./robots/tron/provenance.json", "./robots/so-arm/so-arm.glb", "./robots/so-arm/so-arm.asset-manifest.json", "./robots/so-arm/so-arm.kinematics.json", "./robots/so-arm/provenance.json", "./robots/lk-lift/lk-lift.glb", "./robots/lk-lift/lk-lift.asset-manifest.json", "./robots/lk-lift/lk-lift.kinematics.json", "./robots/lk-lift/provenance.json", "./asset-manifest.v1.schema.json", "./robot-kinematics.v1.schema.json", "./package.json"] },
    { "manifest": "packages/core/package.json", "name": "@lk-design-system/lds-3d-core", "version": "0.1.0-alpha.2", "exports": [".", "./coordinates", "./occupancy-grid", "./entities", "./camera", "./interaction", "./renderer", "./time", "./theme", "./package.json"] },
    { "manifest": "packages/markers/package.json", "name": "@lk-design-system/lds-3d-markers", "version": "0.1.0-alpha.2", "exports": [".", "./package.json"] },
    { "manifest": "packages/pointcloud/package.json", "name": "@lk-design-system/lds-3d-pointcloud", "version": "0.1.0-alpha.2", "exports": [".", "./package.json"] },
    { "manifest": "packages/r3f/package.json", "name": "@lk-design-system/lds-3d-r3f", "version": "0.1.0-alpha.2", "exports": [".", "./coordinates", "./themes", "./state", "./models", "./scene", "./package.json"] },
    { "manifest": "packages/testing/package.json", "name": "@lk-design-system/lds-3d-testing", "version": "0.1.0-alpha.2", "exports": [".", "./fixtures", "./contracts", "./provenance", "./package.json"] },
    { "manifest": "packages/tf/package.json", "name": "@lk-design-system/lds-3d-tf", "version": "0.1.0-alpha.2", "exports": [".", "./package.json"] },
    { "manifest": "packages/three/package.json", "name": "@lk-design-system/lds-3d-three", "version": "0.1.0-alpha.2", "exports": [".", "./coordinates", "./r3f-bridge", "./package.json"] }
  ]
}
